    {
        "$schema": "http://json-schema.org/draft-04/schema#",
        "properties": {
            "author": {
                "type": "string"
            },
            "id": {
                "type": "integer"
            },
            "pages": {
                "type": "integer"
            },
            "title": {
                "type": "string"
            }
        },
        "required": [
            "id",
            "author",
            "pages",
            "title"
        ],
        "type": "object"
    }